{
  "$schema": "https://json-schema.org/draft/2020-12/schema",
  "$id": "https://edugrade.local/contracts/grading-agent/v1/response.schema.json",
  "title": "Governed grading-agent suggestion",
  "type": "object",
  "additionalProperties": false,
  "required": [
    "schema_version",
    "request_id",
    "status",
    "delivery",
    "suggested_score",
    "max_score",
    "confidence",
    "matched_points",
    "missing_points",
    "deductions",
    "evidence",
    "risk_flags",
    "needs_human_review",
    "student_feedback",
    "teacher_note",
    "model_version",
    "prompt_version",
    "rubric_version",
    "capability_profile",
    "mock",
    "telemetry"
  ],
  "properties": {
    "schema_version": {"const": "grading-agent-v1"},
    "request_id": {"type": "string", "minLength": 8, "maxLength": 128},
    "status": {"const": "suggestion"},
    "delivery": {"type": "string", "enum": ["teacher_suggestion", "shadow_only"]},
    "suggested_score": {"type": "number", "minimum": 0, "maximum": 1000},
    "max_score": {"type": "number", "exclusiveMinimum": 0, "maximum": 1000},
    "confidence": {"type": "number", "minimum": 0, "maximum": 1},
    "matched_points": {
      "type": "array",
      "maxItems": 100,
      "items": {
        "type": "object",
        "additionalProperties": false,
        "required": ["rubric_point_id", "label", "score", "evidence_ids"],
        "properties": {
          "rubric_point_id": {"type": "string", "minLength": 1, "maxLength": 128},
          "label": {"type": "string", "minLength": 1, "maxLength": 4000},
          "score": {"type": "number", "minimum": 0, "maximum": 1000},
          "evidence_ids": {"type": "array", "minItems": 1, "maxItems": 100, "items": {"type": "string", "minLength": 1, "maxLength": 128}}
        }
      }
    },
    "missing_points": {
      "type": "array",
      "maxItems": 100,
      "items": {
        "type": "object",
        "additionalProperties": false,
        "required": ["rubric_point_id", "label", "reason"],
        "properties": {
          "rubric_point_id": {"type": "string", "minLength": 1, "maxLength": 128},
          "label": {"type": "string", "minLength": 1, "maxLength": 4000},
          "reason": {"type": "string", "minLength": 1, "maxLength": 2000}
        }
      }
    },
    "deductions": {"type": "array", "maxItems": 0},
    "evidence": {
      "type": "array",
      "maxItems": 200,
      "items": {
        "type": "object",
        "additionalProperties": false,
        "required": ["evidence_id", "rubric_point_id", "text_excerpt", "location", "confidence"],
        "properties": {
          "evidence_id": {"type": "string", "minLength": 1, "maxLength": 128},
          "rubric_point_id": {"type": "string", "minLength": 1, "maxLength": 128},
          "text_excerpt": {"type": "string", "minLength": 1, "maxLength": 4000},
          "location": {"const": "answer_text"},
          "confidence": {"type": "number", "minimum": 0, "maximum": 1}
        }
      }
    },
    "risk_flags": {
      "type": "array",
      "uniqueItems": true,
      "items": {
        "type": "string",
        "enum": [
          "ocr_low_confidence",
          "ocr_text_empty_review_required",
          "ambiguous_answer",
          "insufficient_evidence",
          "possible_off_topic",
          "score_needs_review",
          "schema_repaired",
          "prompt_injection_suspected",
          "human_review_required"
        ]
      }
    },
    "needs_human_review": {"const": true},
    "student_feedback": {"type": "string", "minLength": 1, "maxLength": 8000},
    "teacher_note": {"type": "string", "minLength": 1, "maxLength": 8000},
    "model_version": {"type": "string", "minLength": 1, "maxLength": 256},
    "prompt_version": {"type": "string", "minLength": 1, "maxLength": 128},
    "rubric_version": {"type": "string", "minLength": 1, "maxLength": 128},
    "capability_profile": {"const": "local-pilot-v1"},
    "mock": {"const": false},
    "telemetry": {
      "type": "object",
      "additionalProperties": false,
      "required": ["adapter", "attempts", "repair_attempted", "prior_error_codes", "elapsed_ms"],
      "properties": {
        "adapter": {"const": "local_llama_cpp"},
        "attempts": {"type": "integer", "minimum": 1, "maximum": 2},
        "repair_attempted": {"type": "boolean"},
        "prior_error_codes": {"type": "array", "maxItems": 2, "items": {"type": "string", "minLength": 1, "maxLength": 128}},
        "elapsed_ms": {"type": "integer", "minimum": 0}
      }
    }
  }
}
